{
  "$schema": "https://json-schema.org/draft/2020-12/schema",
  "$id": "https://beateros.dev/contracts/memory_record.schema.json",
  "title": "MemoryRecord",
  "description": "Knowledge with provenance. final.md section 12.6. Memory has a source and an access policy, can be invalidated, and derived memory can be rebuilt from the source event.",
  "type": "object",
  "required": [
    "memory_id",
    "source_event_id",
    "source_digest",
    "writer",
    "created_at",
    "kind",
    "content_ref",
    "summary",
    "confidence",
    "sensitivity",
    "expiry",
    "access_policy"
  ],
  "properties": {
    "memory_id": { "$ref": "common.schema.json#/$defs/Id" },
    "source_event_id": {
      "$ref": "common.schema.json#/$defs/Id",
      "description": "Journal event this memory was projected from. Answers 'why do you know this?'."
    },
    "source_digest": { "$ref": "common.schema.json#/$defs/Digest" },
    "writer": { "$ref": "common.schema.json#/$defs/Id" },
    "created_at": { "$ref": "common.schema.json#/$defs/Timestamp" },
    "kind": { "$ref": "common.schema.json#/$defs/MemoryKind" },
    "content_ref": {
      "type": "string",
      "minLength": 1,
      "description": "Content-addressed reference to the memory body (not the body inline), so it can be redacted."
    },
    "summary": { "type": "string" },
    "confidence": {
      "type": "number",
      "minimum": 0,
      "maximum": 1,
      "description": "Calibrated confidence in [0, 1]."
    },
    "sensitivity": { "$ref": "common.schema.json#/$defs/DataClass" },
    "expiry": {
      "anyOf": [
        { "$ref": "common.schema.json#/$defs/Timestamp" },
        { "type": "null" }
      ],
      "description": "When this memory must be forgotten, or null for no scheduled expiry."
    },
    "access_policy": {
      "type": "string",
      "minLength": 1,
      "description": "Named policy governing who/what may read this memory."
    }
  },
  "additionalProperties": true
}
