{
  "memory_id": "mem_parser_bug_pattern",
  "source_event_id": "evt_receipt_write_parser_fix",
  "source_digest": "sha256:4e07408562bedb8b60ce05c1decfe3ad16b72230967de01f640b7e4729b49fce",
  "writer": "agent:coder-1",
  "created_at": "2026-07-03T18:06:00Z",
  "kind": "episodic",
  "content_ref": "cas://sha256:2c26b46b68ffc68ff99b453c1d30413413422d706483bfa0f98a5e886266e7ae",
  "summary": "Lexer span off-by-one recurs when a multibyte char precedes a token boundary.",
  "confidence": 0.8,
  "sensitivity": "code",
  "expiry": null,
  "access_policy": "workspace-internal"
}
